"1","The impact of human activities and lifestyles on the interlinked microbiota and health of humans and of ecosystems","Plants, animals and humans, are colonized by microorganisms (microbiota) and transiently exposed to countless others. The microbiota affects the development and function of essentially all organ systems, and contributes to adaptation and evolution, while protecting against pathogenic microorganisms and toxins. Genetics and lifestyle factors, including diet, antibiotics and other drugs, and exposure to the natural environment, affect the composition of the microbiota, which influences host health through modulation of interrelated physiological systems. These include immune system development and regulation, metabolic and endocrine pathways, brain function and epigenetic modification of the genome. Importantly, parental microbiotas have transgenerational impacts on the health of progeny. Humans, animals and plants share similar relationships with microbes. Research paradigms from humans and other mammals, amphibians, insects, planktonic crustaceans and plants demonstrate the influence of environmental microbial ecosystems on the microbiota and health of organisms, and indicate links between environmental and internal microbial diversity and good health. Therefore, overlapping compositions, and interconnected roles of microbes in human, animal and plant health should be considered within the broader context of terrestrial and aquatic microbial ecosystems that are challenged by the human lifestyle and by agricultural and industrial activities. Here, we propose research priorities and organizational, educational and administrative measures that will help to identify safe microbe-associated health-promoting modalities and practices. In the spirit of an expanding version of “One health” that includes environmental health and its relation to human cultures and habits (EcoHealth), we urge that the lifestyle-microbiota-human health nexus be taken into account in societal decision making."
"3","The impact of human activities and lifestyles on the interlinked microbiota and health of humans and of ecosystems","Plants, animals and humans, are colonized by microorganisms (microbiota) and transiently exposed to countless others. The microbiota affects the development and function of essentially all organ systems, and contributes to adaptation and evolution, while protecting against pathogenic microorganisms and toxins. Genetics and lifestyle factors, including diet, antibiotics and other drugs, and exposure to the natural environment, affect the composition of the microbiota, which influences host health through modulation of interrelated physiological systems. These include immune system development and regulation, metabolic and endocrine pathways, brain function and epigenetic modification of the genome. Importantly, parental microbiotas have transgenerational impacts on the health of progeny. Humans, animals and plants share similar relationships with microbes. Research paradigms from humans and other mammals, amphibians, insects, planktonic crustaceans and plants demonstrate the influence of environmental microbial ecosystems on the microbiota and health of organisms, and indicate links between environmental and internal microbial diversity and good health. Therefore, overlapping compositions, and interconnected roles of microbes in human, animal and plant health should be considered within the broader context of terrestrial and aquatic microbial ecosystems that are challenged by the human lifestyle and by agricultural and industrial activities. Here, we propose research priorities and organizational, educational and administrative measures that will help to identify safe microbe-associated health-promoting modalities and practices. In the spirit of an expanding version of “One health” that includes environmental health and its relation to human cultures and habits (EcoHealth), we urge that the lifestyle-microbiota-human health nexus be taken into account in societal decision making."
"3","The microbiome of the built environment and mental health","The microbiome of the built environment (MoBE) is a relatively new area of study. While some knowledge has been gained regarding impacts of the MoBE on the human microbiome and disease vulnerability, there is little knowledge of the impacts of the MoBE on mental health. Depending on the specific microbial species involved, the transfer of microorganisms from the built environment to occupant’s cutaneous or mucosal membranes has the potential to increase or disrupt immunoregulation and/or exaggerate or suppress inflammation. Preclinical evidence highlighting the influence of the microbiota on systemic inflammation supports the assertion that microorganisms, including those originating from the built environment, have the potential to either increase or decrease the risk of inflammation-induced psychiatric conditions and their symptom severity. With advanced understanding of both the ecology of the built environment, and its influence on the human microbiome, it may be possible to develop bioinformed strategies for management of the built environment to promote mental health. Here we present a brief summary of microbiome research in both areas and highlight two interdependencies including the following: (1) effects of the MoBE on the human microbiome and (2) potential opportunities for manipulation of the MoBE in order to improve mental health. In addition, we propose future research directions including strategies for assessment of changes in the microbiome of common areas of built environments shared by multiple human occupants, and associated cohort-level changes in the mental health of those who spend time in the buildings. Overall, our understanding of the fields of both the MoBE and influence of host-associated microorganisms on mental health are advancing at a rapid pace and, if linked, could offer considerable benefit to health and wellness."
"1","Grape berry surface bacterial microbiome: impact from the varieties and clones in the same vineyard from central China","Aims Bacterial microbiome on grape berry surface may play an important role in grape quality and health. This study aims to investigate the impact of grape varieties and clones on grape berry surface bacterial microbiome from the same vineyard. Methods and Results High-throughput sequencing strategy was used to investigate the bacterial diversity and abundance on the grape surfaces of 12 clones belonging to six varieties grown in the same vineyard of Zhengzhou Fruit Research Institute in Henan Province. In total, 45 bacterial phyla and 933 genera were detected from all samples. Cyanobacteria, Proteobacteria and Firmicutes were the most abundant and prevalent phyla, while Bacteroidetes, Chloroflexi, Acidobacteria and Planctomycetes were grape clone specific phyla. The nonrank genus from phylum Cyanobacteria occupied 30–81% of grape clones from Italian Riesling (GRX), Cabernet Franc (PLZ), Pinot Blanc (BBN) and Riesling (LSL). Interestingly, Bacillus, Pseudomonas and Lactococcus were the only three prevalent genera found on all the clones. Furthermore, the predicted functional activities of grape surface bacterial communities varied according to the clones. Conclusions The present study revealed that in addition to the grape varieties, the variations in grape clone background may also affect the bacterial microbiome on grape surfaces which may ultimately determine their functional activities. Significance and Impact of the Study This research provides an important information for grape planting and wine fermentation that not only the grape varieties need to be paid attention but also grape clones from the specific variety need to be concerned."
"1","The Human Mesenteric Lymph Node Microbiome Differentiates Between Crohn’s Disease and Ulcerative Colitis","Background and Aims \ Mesenteric lymph nodes are sites in which translocated bacteria incite and progress immunological responses. For this reason, understanding the microbiome of mesenteric lymph nodes in inflammatory bowel disease is important. The bacterial profile of Crohn’s disease mesenteric lymph nodes has been analysed using culture-independent methods in only one previous study. This study aimed to investigate the mesenteric lymph node microbiota from both Crohn’s disease and ulcerative colitis patients. \  \ Methods \ Mesenteric lymph nodes were collected from Crohn’s disease and ulcerative colitis patients undergoing resection. Total DNA was extracted from mesenteric lymph nodes and assessed for the presence of bacterial DNA [16S]. All work was completed in a sterile environment using aseptic techniques. Samples positive for 16S DNA underwent next-generation sequencing, and the identity of bacterial phyla and species were determined. \  \ Results \ Crohn’s disease mesenteric lymph nodes had a distinctly different microbial profile to that observed in ulcerative colitis. The relative abundance of Firmicutes was greater in nodes from ulcerative colitis patients, whereas Proteobacteria were more abundant in Crohn’s disease. Although species diversity was reduced in the mesenteric lymph nodes of patients with Crohn’s disease, these lymph nodes contained greater numbers of less dominant phyla, mainly Fusobacteria. \  \ Conclusion \ This study confirms that there are distinct differences between the Crohn’s disease and ulcerative colitis mesenteric lymph node microbiomes. Such microbial differences could aid in the diagnosis of Crohn’s disease or ulcerative colitis, particularly in cases of indeterminate colitis at time of resection, or help explain their mechanisms of development and progression."
"3","Delayed differentiation of vaginal and uterine microbiomes in dairy cows developing postpartum endometritis","Bacterial overgrowth in the uterus is a normal event after parturition. In contrast to the healthy cow, animals unable to control the infection within 21 days after calving develop postpartum endometritis. Studies on the Microbial Ecology of the bovine reproductive tract have focused on either vaginal or uterine microbiomes. This is the first study that compares both microbiomes in the same animals. Terminal Restriction Fragment Length Polymorphism of the 16S rRNA gene showed that despite large differences associated to individuals, a shared community exist in vagina and uterus during the postpartum period. The largest changes associated with development of endometritis were observed at 7 days postpartum, a time when vaginal and uterine microbiomes were most similar. 16S rRNA pyrosequencing of the vaginal microbiome at 7 days postpartum showed at least three different microbiome types that were associated with later development of postpartum endometritis. All three microbiome types featured reduced bacterial diversity. Taken together, the above findings support a scenario where disruption of the compartmentalization of the reproductive tract during parturition results in the dispersal and mixing of the vaginal and uterine microbiomes, which subsequently are subject to differentiation. This differentiation was observed early postpartum in the healthy cow. In contrast, loss of bacterial diversity and dominance of the microbiome by few bacterial taxa were related to a delayed succession at 7DPP in cows that at 21 DPP or later were diagnosed with endometritis.;"
"1","Environment dominates over host genetics in shaping human gut microbiota","Human gut microbiome composition is shaped by multiple factors but the relative contribution of host genetics remains elusive. Here we examine genotype and microbiome data from 1,046 healthy individuals with several distinct ancestral origins who share a relatively common environment, and demonstrate that the gut microbiome is not significantly associated with genetic ancestry, and that host genetics have a minor role in determining microbiome composition. We show that, by contrast, there are significant similarities in the compositions of the microbiomes of genetically unrelated individuals who share a household, and that over 20% of the inter-person microbiome variability is associated with factors related to diet, drugs and anthropometric measurements. We further demonstrate that microbiome data significantly improve the prediction accuracy for many human traits, such as glucose and obesity measures, compared to models that use only host genetic and environmental data. These results suggest that microbiome alterations aimed at improving clinical outcomes may be carried out across diverse genetic backgrounds."
"3","Environment dominates over host genetics in shaping human gut microbiota","Human gut microbiome composition is shaped by multiple factors but the relative contribution of host genetics remains elusive. Here we examine genotype and microbiome data from 1,046 healthy individuals with several distinct ancestral origins who share a relatively common environment, and demonstrate that the gut microbiome is not significantly associated with genetic ancestry, and that host genetics have a minor role in determining microbiome composition. We show that, by contrast, there are significant similarities in the compositions of the microbiomes of genetically unrelated individuals who share a household, and that over 20% of the inter-person microbiome variability is associated with factors related to diet, drugs and anthropometric measurements. We further demonstrate that microbiome data significantly improve the prediction accuracy for many human traits, such as glucose and obesity measures, compared to models that use only host genetic and environmental data. These results suggest that microbiome alterations aimed at improving clinical outcomes may be carried out across diverse genetic backgrounds."
"1","The human milk microbiome changes over lactation and is shaped by maternal weight and mode of delivery","ABSTRACT.  Background: Breast milk is recognized as the most important postpartum element in metabolic and immunologic programming of health of neonates. The fa"
"2","Four steps to precision public health","Better surveillance data and analyses are urgently needed to control disease in the developing world, argue Scott F."
"3","Four steps to precision public health","Better surveillance data and analyses are urgently needed to control disease in the developing world, argue Scott F."
"1","A broken promise: microbiome differential abundance methods do not control the false discovery rate","High-throughput sequencing technologies allow easy characterization of the human microbiome, but the statistical methods to analyze microbiome data are still in their infancy. Differential abundance methods aim at detecting associations between the abundances of bacterial species and subject grouping factors. The results of such methods are important to identify the microbiome as a prognostic or diagnostic biomarker or to demonstrate efficacy of prodrug or antibiotic drugs. Because of a lack of benchmarking studies in the microbiome field, no consensus exists on the performance of the statistical methods. We have compared a large number of popular methods through extensive parametric and nonparametric simulation as well as real data shuffling algorithms. The results are consistent over the different approaches and all point to an alarming excess of false discoveries. This raises great doubts about the reliability of discoveries in past studies and imperils reproducibility of microbiome experiments. To further improve method benchmarking, we introduce a new simulation tool that allows to generate correlated count data following any univariate count distribution; the correlation structure may be inferred from real data. Most simulation studies discard the correlation between species, but our results indicate that this correlation can negatively affect the performance of statistical methods."
"1","Effects of elevated carbon dioxide on environmental microbes and its mechanisms: A review","Before the industrial revolution, the atmospheric CO2 concentration was 180–330 ppm; however, fossil-fuel combustion and forest destruction have led to increased atmospheric CO2 concentration. CO2 capture and storage is regarded as a promising strategy to prevent global warming and ocean acidification and to alleviate elevated atmospheric CO2 concentration, but the leakage of CO2 from storage system can lead to rapid acidification of the surrounding circumstance, which might cause negative influence on environmental microbes. The effects of elevated CO2 on microbes have been reported extensively, but the review regarding CO2 affecting different environmental microorganisms has never been done previously. Also, the mechanisms of CO2 affecting environmental microorganisms are usually contributed to the change of pH values, while the direct influences of CO2 on microorganisms were often neglected. This paper aimed to provide a systematic review of elevated CO2 affecting environmental microbes and its mechanisms. Firstly, the influences of elevated CO2 and potential leakage of CO2 from storage sites on community structures and diversity of different surrounding environmental microbes were assessed and compared. Secondly, the adverse impacts of CO2 on microbial growth, cell morphology and membranes, bacterial spores, and microbial metabolism were introduced. Then, based on biochemical principles and knowledge of microbiology and molecular biology, the fundamental mechanisms of the influences of carbon dioxide on environmental microbes were discussed from the aspects of enzyme activity, electron generation and transfer, and key gene and protein expressions. Finally, key questions relevant to the environmental effect of CO2 that need to be answered in the future were addressed."
"1","Gut to Brain Dysbiosis: Mechanisms Linking Western Diet Consumption, the Microbiome, and Cognitive Impairment","Consumption of a Western Diet (WD) that is high in saturated fat and added sugars negatively impacts cognitive function, particularly mnemonic processes that rely on the integrity of the hippocampus. Emerging evidence suggests that the gut microbiome influences cognitive function via the gut-brain axis, and that WD factors significantly alter the proportions of commensal bacteria in the gastrointestinal tract. Here we review mechanisms through which consuming a WD negatively impacts neurocognitive function, with a particular focus on recent evidence linking the gut microbiome with dietary- and metabolic-associated hippocampal impairment. We highlight evidence linking gut bacteria to altered intestinal permeability and blood brain barrier integrity, thus making the brain more vulnerable to the influx of deleterious substances from the circulation. WD consumption also increases production of endotoxin by commensal bacteria, which may promote neuroinflammation and cognitive dysfunction. Recent findings also show that diet-induced alterations in gut microbiota impair peripheral insulin sensitivity, which is associated with hippocampal neuronal derrangements and associated mnemonic deficits. In some cases treatment with specific probiotics or prebiotics can prevent or reverse some of the deleterious impact of WD consumption on neuropsychological outcomes, indicating that targeting the microbiome may be a successful strategy for combating dietary- and metabolic-associated cognitive impairment."
"2","Gut to Brain Dysbiosis: Mechanisms Linking Western Diet Consumption, the Microbiome, and Cognitive Impairment","Consumption of a Western Diet (WD) that is high in saturated fat and added sugars negatively impacts cognitive function, particularly mnemonic processes that rely on the integrity of the hippocampus. Emerging evidence suggests that the gut microbiome influences cognitive function via the gut-brain axis, and that WD factors significantly alter the proportions of commensal bacteria in the gastrointestinal tract. Here we review mechanisms through which consuming a WD negatively impacts neurocognitive function, with a particular focus on recent evidence linking the gut microbiome with dietary- and metabolic-associated hippocampal impairment. We highlight evidence linking gut bacteria to altered intestinal permeability and blood brain barrier integrity, thus making the brain more vulnerable to the influx of deleterious substances from the circulation. WD consumption also increases production of endotoxin by commensal bacteria, which may promote neuroinflammation and cognitive dysfunction. Recent findings also show that diet-induced alterations in gut microbiota impair peripheral insulin sensitivity, which is associated with hippocampal neuronal derrangements and associated mnemonic deficits. In some cases treatment with specific probiotics or prebiotics can prevent or reverse some of the deleterious impact of WD consumption on neuropsychological outcomes, indicating that targeting the microbiome may be a successful strategy for combating dietary- and metabolic-associated cognitive impairment."
"1","Planned home birth: benefits, risks, and opportunities","While the number of women in developed countries who plan a home birth is low, the number has increased over the past decade in the US, and there is evidence that more women would choose this option if it were readily available. Rates of planned home birth range from 0.1% in Sweden to 20% in the Netherlands, where home birth has always been an integrated part of the maternity system. Benefits of planned home birth include lower rates of maternal morbidity, such as postpartum hemorrhage, and perineal lacerations, and lower rates of interventions such as episiotomy, instrumental vaginal birth, and cesarean birth. Women who have a planned home birth have high rates of satisfaction related to home being a more comfortable environment and feeling more in control of the experience. While maternal outcomes related to planned birth at home have been consistently positive within the literature, reported neonatal outcomes during planned home birth are more variable. While the majority of investigations of planned home birth compared with hospital birth have found no difference in intrapartum fetal deaths, neonatal deaths, low Apgar scores, or admission to the neonatal intensive care unit, there have been reports in the US, as well as a meta-analysis, that indicated more adverse neonatal outcomes associated with home birth. There are multiple challenges associated with research designs focused on planned home birth, in part because conducting randomized controlled trials is not feasible. This report will review current research studies published between 2004 and 2014 related to maternal and neonatal outcomes of planned home birth, and discuss strengths, limitations, and opportunities regarding planned home birth."
"3","Planned home birth: benefits, risks, and opportunities","While the number of women in developed countries who plan a home birth is low, the number has increased over the past decade in the US, and there is evidence that more women would choose this option if it were readily available. Rates of planned home birth range from 0.1% in Sweden to 20% in the Netherlands, where home birth has always been an integrated part of the maternity system. Benefits of planned home birth include lower rates of maternal morbidity, such as postpartum hemorrhage, and perineal lacerations, and lower rates of interventions such as episiotomy, instrumental vaginal birth, and cesarean birth. Women who have a planned home birth have high rates of satisfaction related to home being a more comfortable environment and feeling more in control of the experience. While maternal outcomes related to planned birth at home have been consistently positive within the literature, reported neonatal outcomes during planned home birth are more variable. While the majority of investigations of planned home birth compared with hospital birth have found no difference in intrapartum fetal deaths, neonatal deaths, low Apgar scores, or admission to the neonatal intensive care unit, there have been reports in the US, as well as a meta-analysis, that indicated more adverse neonatal outcomes associated with home birth. There are multiple challenges associated with research designs focused on planned home birth, in part because conducting randomized controlled trials is not feasible. This report will review current research studies published between 2004 and 2014 related to maternal and neonatal outcomes of planned home birth, and discuss strengths, limitations, and opportunities regarding planned home birth."
