"1","Microbiome networks and change-point analysis reveal key community changes associated with cystic fibrosis pulmonary exacerbations","Episodes of significant worsening of cystic fibrosis symptoms, known as pulmonary exacerbations (PEs), are associated with oxygen-deficient (anoxic) conditions and increased activity of ‘anaerobic’ bacteria, which thrive in the absence of oxygen. Researchers in Canada, led by David Guttman at the University of Toronto, compared genetic data on microbial populations in sputum samples collected during PEs and at times of better health. The study revealed a strong correlation between the activity and interactions among anaerobic bacteria and the onset of PEs. Investigating the significance of these changes in the lung environment and its microbial populations may help design treatment strategies to reduce the frequency of PEs and their potentially fatal consequences. The authors suggest that antibiotics that specifically target anaerobic bacteria may prove beneficial, as may hyperbaric oxygen therapy, which oxygenates the lung tissue."
"1","Insights into microbiome research 4: The computational analysis","The computational analysis of microbiome samples is a highly specialized task, requiring powerful hardware and deep know-how not only in informatics and statistics but also in ecology and taxonomy. Different approaches must be followed based on the sequencing method (16S or shotgun) and while these can provide partially overlapping information, they are conceptually distinct. Understanding their differences and similarities can be useful in the interpretation of the results of microbiome studies."
"1","The microbiome in patients with atopic dermatitis","As an interface with the environment, the skin is a complex ecosystem colonized by many microorganisms that coexist in an established balance. The cutaneous microbiome inhibits colonization with pathogens, such as Staphylococcus aureus, and is a crucial component for function of the epidermal barrier. Moreover, crosstalk between commensals and the immune system is now recognized because microorganisms can modulate both innate and adaptive immune responses. Host-commensal interactions also have an effect on the developing immune system in infants and, subsequently, the occurrence of diseases, such as asthma and atopic dermatitis (AD). Later in life, the cutaneous microbiome contributes to the development and course of skin disease. Accordingly, in patients with AD, a decrease in microbiome diversity correlates with disease severity and increased colonization with pathogenic bacteria, such as S aureus. Early clinical studies suggest that topical application of commensal organisms (eg, Staphylococcus hominis or Roseomonas mucosa) reduces AD severity, which supports an important role for commensals in decreasing S aureus colonization in patients with AD. Advancing knowledge of the cutaneous microbiome and its function in modulating the course of skin disorders, such as AD, might result in novel therapeutic strategies."
"1","A unified conceptual framework for prediction and control of microbiomes","Microbiomes impact nearly all systems on Earth, and despite vast differences among systems, we contend that it is possible and highly beneficial to develop a unified conceptual framework for understanding microbiome dynamics that is applicable across systems. The ability to robustly predict and control environmental and human microbiomes would provide impactful opportunities to sustain and improve the health of ecosystems and humans alike. Doing so requires understanding the processes governing microbiome temporal dynamics, which currently presents an enormous challenge. We contend, however, that new opportunities can emerge by placing studies of both environmental and human microbiome temporal dynamics in the context of a unified conceptual framework. Our conceptual framework poses that factors influencing the temporal dynamics of microbiomes can be grouped into three broad categories: biotic and abiotic history, internal dynamics, and external forcing factors. Both environmental and human microbiome science study these factors, but not in a coordinated or consistent way. Here we discuss opportunities for greater crosstalk across these domains, such as leveraging specific ecological concepts from environmental microbiome science to guide optimization of strategies to manipulate human microbiomes towards improved health. To achieve unified understanding, it is necessary to have a common body of theory developed from explicit iteration between models and molecular-based characterization of microbiome dynamics across systems. Only through such model-experiment iteration will we eventually achieve prediction and control across microbiomes that impact ecosystem sustainability and human health."
"1","Bi-directional drug-microbiome interactions of anti-diabetics","Type 2 diabetes (T2D) has become a global epidemic. Although several drugs are available to manage T2D, problems associated with person-to-person variability in drug efficacy and potential side-effects remain unresolved. Owing to the emerging role of the gut microbiome in obesity and T2D, the interaction between gut microbes and anti-diabetic drugs and its influence on drugs' functions remains of immediate research interest. On one hand, drugs can manipulate gut microbiome composition and metabolic capacity. Conversely, the metabolic activities of the microbiome and its metabolites can also influence drug metabolism and effects. Hence, understanding this bi-directional drug-microbiome interaction and how it influences the clinical outcomes of antidiabetic drugs can pave the way to develop next-generation strategies to ameliorate diabetes. This review presents evidences demonstrating the putative interactions between anti-diabetic drugs and the gut microbiome, and discusses the potential of microbiome modulators to manipulate drug-microbiome interactions and the drug metabolism."
"1","Maternal microbiome and pregnancy outcomes","Alterations of the human microbiome are a known characteristic of various inflammatory disease states and have been linked to spontaneous preterm birth and other adverse pregnancy outcomes. Recent advances in metagenomic research have proven that the placenta harbors its own rich diverse microbiome, even in clinically healthy pregnancies, and preterm birth may be a result of hematogenous infection rather than exclusively ascending infection as previously hypothesized. In this review, we describe the microbiome in healthy nongravid and gravid women to contrast it with the alterations of the microbiome associated with spontaneous preterm birth. We also discuss the importance of host gene-environment interactions and the potential for microbiota-specific targeted therapies to reduce the risk of adverse pregnancy outcomes."
"1","Safe, Healthy Birth: What Every Pregnant Woman Needs to Know","In spite of technology and medical science's ability to manage complex health problems, the current maternity care environment has increased risks for healthy women and their babies. It comes as a surprise to most women that standard maternity care does not reflect best scientific evidence. In this column, evidence-based maternity care practices are discussed with an emphasis on the practices that increase safety for mother and baby, and what pregnant women need to know in order to have safe, healthy births is described."
"2","Safe, Healthy Birth: What Every Pregnant Woman Needs to Know","In spite of technology and medical science's ability to manage complex health problems, the current maternity care environment has increased risks for healthy women and their babies. It comes as a surprise to most women that standard maternity care does not reflect best scientific evidence. In this column, evidence-based maternity care practices are discussed with an emphasis on the practices that increase safety for mother and baby, and what pregnant women need to know in order to have safe, healthy births is described."
"3","Safe, Healthy Birth: What Every Pregnant Woman Needs to Know","In spite of technology and medical science's ability to manage complex health problems, the current maternity care environment has increased risks for healthy women and their babies. It comes as a surprise to most women that standard maternity care does not reflect best scientific evidence. In this column, evidence-based maternity care practices are discussed with an emphasis on the practices that increase safety for mother and baby, and what pregnant women need to know in order to have safe, healthy births is described."
"1","Ecological and Evolutionary Forces Shaping Microbial Diversity in the Human Intestine","The human gut is populated with as many as 100 trillion cells, whose collective genome, the microbiome, is a reflection of evolutionary selection pressures acting at the level of the host and at the level of the microbial cell. The ecological rules that govern the shape of microbial diversity in the gut apply to mutualists and pathogens alike."
"1","Gut microbiome and cancer immunotherapy","Microbiome is becoming crucial in that the balance between human health and disease can be mediated by the gut microbiome. The gut microbiome can modulate the host immune system both locally and systemically. Cancer immunotherapy has emerged as a promising way in the treatment of patients with cancer. Accumulating evidence supports that microbiome affects the therapeutic efficacy of cancer immunotherapy, particularly immune checkpoint inhibitors. Here, we discuss the mutual relationship among gut microbiome, cancer, immunity, and cancer immunotherapy, with a focus on immunotherapy. Also, we briefly introduce the relevant challenges that affect the therapeutic efficacy and present the possible solutions."
"1","Linking metacommunity theory and symbiont evolutionary ecology","Processes that occur both within and between hosts can influence the ecological and evolutionary dynamics of symbionts, a broad term that includes parasitic and disease-causing organisms. Metacommunity theory can integrate these local- and regional-scale dynamics to explore symbiont community composition patterns across space. In this article I emphasize that symbionts should be incorporated into the metacommunity concept. I highlight the utility of metacommunity theory by discussing practical and general benefits that emerge from considering symbionts in a metacommunity framework. Specifically, investigating the local and regional drivers of symbiont community and metacommunity structure will lead to a more holistic understanding of symbiont ecology and evolution and could reveal novel insights into the roles of symbiont communities in mediating host health."
"1","Analysis of the relationship between the gut microbiome and dementia: a cross-sectional study conducted in Japan","Dysregulation of the gut microbiome is associated with several life-threatening conditions and thus might represent a useful target for the prevention of dementia. However, the relationship between the gut microbial population and dementia has not yet been fully clarified. We recruited outpatients visiting our memory clinic to participate in this study. Information on patient demographics, risk factors, and activities of daily living was collected, and cognitive function was assessed using neuropsychological tests and brain magnetic resonance imaging scans. Fecal samples were obtained, and the gut microbiome was assessed by terminal restriction fragment length polymorphism (T-RFLP) analysis, one of the most well-established and reliable 16S ribosomal RNA-based methods for classifying gut microbiota. Patients were divided into two groups, demented and non-demented. Multivariable logistic regression models were used to identify the variables independently associated with dementia. The T-RFLP analysis revealed differences in the composition of the gut microbiome: the number of Bacteroides (enterotype I) was lower and the number of ‘other’ bacteria (enterotype III) was higher in demented than non-demented patients. Multivariable analyses showed that the populations of enterotype I and enterotype III bacteria were strongly associated with dementia, independent of the traditional dementia biomarkers. Further studies of the metabolites of gut microbes are needed to determine the mechanism underlying this association."
"1","What can the gut microbiome teach us about the connections between child physical and mental health? A systematic review","A deeper understanding of the gut-brain axis is of significance in pediatrics, given the influential role of early childhood experiences and exposures in shaping the microbiome, and health, across the life course. This systematic review synthesized evidence on the connection between the gut microbiome and mental health in children with physical illness. Six electronic databases were systematically searched and data extracted according to the Preferred Reporting Items for Systematic reviews and Meta-Analyses (PRISMA) guidelines. Of 1,476 identified articles, 11 articles reporting on nine unique studies (all randomized controlled trials) were included. Most studies examined the gut microbiome in infants with colic, while the remaining studies investigated outcomes in children aged 1 day to 18 years at risk for atopic dermatitis or irritable bowel syndrome. Baseline and postintervention gut microbiome differences varied across studies. Findings on psychological functioning also varied, with only half of the captured studies showing a positive effect of intervention on psychological well-being. Only two studies analyzed the association between the gut microbiome and psychological outcomes, each with a different pattern of results. As the field moves forward, it will be critical to gain a better understanding of the microbiome characteristics that influence mental health outcomes in pediatric populations."
"2","What can the gut microbiome teach us about the connections between child physical and mental health? A systematic review","A deeper understanding of the gut-brain axis is of significance in pediatrics, given the influential role of early childhood experiences and exposures in shaping the microbiome, and health, across the life course. This systematic review synthesized evidence on the connection between the gut microbiome and mental health in children with physical illness. Six electronic databases were systematically searched and data extracted according to the Preferred Reporting Items for Systematic reviews and Meta-Analyses (PRISMA) guidelines. Of 1,476 identified articles, 11 articles reporting on nine unique studies (all randomized controlled trials) were included. Most studies examined the gut microbiome in infants with colic, while the remaining studies investigated outcomes in children aged 1 day to 18 years at risk for atopic dermatitis or irritable bowel syndrome. Baseline and postintervention gut microbiome differences varied across studies. Findings on psychological functioning also varied, with only half of the captured studies showing a positive effect of intervention on psychological well-being. Only two studies analyzed the association between the gut microbiome and psychological outcomes, each with a different pattern of results. As the field moves forward, it will be critical to gain a better understanding of the microbiome characteristics that influence mental health outcomes in pediatric populations."
"2","Stress and the microbiota–gut–brain axis in visceral pain: Relevance to irritable bowel syndrome","Visceral pain is a global term used to describe pain originating from the internal organs of the body, which affects a significant proportion of the population and is a common feature of functional gastrointestinal disorders (FGIDs) such as irritable bowel syndrome (IBS). While IBS is multifactorial, with no single etiology to completely explain the disorder, many patients also experience comorbid behavioral disorders, such as anxiety or depression; thus, IBS is described as a disorder of the gut–brain axis. Stress is implicated in the development and exacerbation of visceral pain disorders. Chronic stress can modify central pain circuitry, as well as change motility and permeability throughout the gastrointestinal (GI) tract. More recently, the role of the gut microbiota in the bidirectional communication along the gut–brain axis, and subsequent changes in behavior, has emerged. Thus, stress and the gut microbiota can interact through complementary or opposing factors to influence visceral nociceptive behaviors. This review will highlight the evidence by which stress and the gut microbiota interact in the regulation of visceral nociception. We will focus on the influence of stress on the microbiota and the mechanisms by which microbiota can affect the stress response and behavioral outcomes with an emphasis on visceral pain. (PsycINFO Database Record (c) 2016 APA, all rights reserved). (journal abstract)"
"1","The Effect of Lean-Seafood and Non-Seafood Diets on Fecal Metabolites and Gut Microbiome: Results from a Randomized Crossover Intervention Study","SCOPE: The impact of dietary protein types on the gut microbiome is scarcely studied. The aim of the present study is therefore to examine the effects of lean-seafood and non-seafood proteins on the gut microbiome composition and activity and elucidate potential associations to cardiovascular disease (CVD) risk factors. \ METHODS: A crossover intervention study in which 20 healthy subjects consumed two diets that varied in protein source was conducted. 1 H NMR spectroscopy and 16S rDNA sequencing analyses were applied to characterize fecal metabolites and gut microbiota composition, respectively. \ RESULTS: A twofold increase in fecal trimethylamine excretion was observed after the lean-seafood diet period. Circulating TAG and the total to high-density lipoprotein (HDL) cholesterol ratio as well as circulating TMAO levels were each associated with specific gut bacteria. Following the non-seafood diet period, a decreased relative abundance of Clostridium cluster IV and a tendency toward an increased Firmicutes/Bacteroidetes ratio were found. \ CONCLUSIONS: Lean-seafood and non-seafood diets differentially modulate the gut microbiome composition and activity. Furthermore, the gut microbiota composition seems to affect circulating TMAO levels and CVD risk factors."
"1","An integrated approach to evaluate the impacts of the herbicides glyphosate, 2,4-D and metsulfuron-methyl on soil microbial communities in the Pampas region, Argentina","The intensive use of herbicides in agricultural soils of the Pampas region (Argentina) is a matter of environmental concern. We investigated the impacts of three widely used, post-emergence herbicides, glyphosate, 2,4-dicholorophenoxyacetic acid (2,4-D) and metsulfuron-methyl, on soil microbial communities by an integrated approach using short-term soil incubations. The key structural and functional parameters were estimated by culturable aerobic heterotrophic bacterial (AHB) density, substrate-induced respiration (SIR), dehydrogenase activity (DHA), fluorescein diacetate (FDA) hydrolysis, and functional richness. Functional richness was evaluated as the proportion of carbon sources utilized in microplates containing various carbohydrates, carboxylic acids, amino acids and aromatic compounds, and 1,3,5-triphenyiltetrazolium chloride (TTC) as redox dye. Three different soil types (Typic Argiudoll, Typic Haplustoll and Petrocalcic Paleustoll) were collected from agricultural fields with reported history of herbicide application. Soil microcosms were treated with one herbicide at a time at a dose 10 times higher than the recommended field application rates (glyphosate, 150mg a.i. kg−1; 2,4-D, 5mg a.i. kg−1; metsulfuron-methyl, 1mg a.i. kg−1soil) and incubated for up to 3 weeks. Metsulfuron-methyl had the least pronounced effects on soil microbial community. 2,4-D showed transient effects on soils, inhibiting either SIR or FDA and stimulating DHA. Several short-term effects of glyphosate on microbial activities and bacterial density were observed: (1) early stimulation of SIR and AHB; (2) dissimilar response in the soils for FDA and DHA; (3) transient increase in functional richness. To conclude, the addition of these herbicides at a dose 10 times higher than the normal field application rates caused minor changes to soil microbial activity, bacterial density and functional richness. The specific changes varied among herbicides, with the effects of glyphosate most pronounced."
"1","Systemic proinflammation after Mycobacterium tuberculosis infection was correlated to the gut microbiome in HIV-uninfected humans","BACKGROUND: The dysbiosis of gut microbiome and interaction with host immunity after Mycobacterium tuberculosis (MTB) infection are under-investigation. We had found fatigue symptom concurrent with dysbiosis by decreasing the ratio of Firmicutes to Bacteroidetes (F/B ratio) in active tuberculosis (TB). The study aims to assess the inflammatory biomarkers and their interaction with gut microbiome in active TB and latent TB infection before starting anti-TB regimens. \ MATERIALS AND METHOD: Interleukin-1 beta (IL-1B), IL-4, IL-6, IL-10, CD3+, CD4+, CD8+ T cells, and interferon-gamma (IFN-γ) releasing assay (IGRA) were measured in 25 active TB patients, 32 LTBI subjects, and 23 healthy controls (HC). Gut microbiome profiles were obtained using 16S rRNA MiSeq sequencing method. \ RESULTS: The leukocytosis (7008±383 cell/cum, p<0.05), increase in IL-6 (229.7±104μg/dL, p<0.05), and decrease in IL-4 (0.27μg/dL±0.1, p<0.05) were presented in active TB. The proportion of polymorphic neutrophil (PMN) in peripheral blood was positively related to the relative abundance of Bacteroidetes in LTBI and active TB (R2 =0.23, p<0.05). The F/B ratio was positively related to the detectable IL-1B in TB (R2 =0.97, p<0.01) and to the IL-4 in LTBI (R2 =0.27, p<0.05). In LTBI, the relative abundances of Coriobacteriales was positively related to the secretion of IFN-gamma against TB antigens more likely associated with of CD4+ T cell (R2 =0.42, p<0.05). \ CONCLUSION: In active TB, dysbiosis with higher relative abundances of Bacteroidetes in stool and low F/B ratio was related to systemic proinflammation. In LTBI, dose-response relationship between peripheral PMN and relative abundances of Bacteroidetes was remained but not lead to systemic inflammation. This article is protected by copyright. All rights reserved."
"1","A finite mixture model for X-chromosome association with an emphasis on microbiome data analysis","Analysis of the X chromosome has been largely neglected in genetic studies mainly because of complex underlying biological mechanisms. On the other hand, the study of human microbiome data (typically over-dispersed counts with an excess of zeros) has generated great interest recently because of advancements in next-generation sequencing technologies. We propose a novel approach to infer the association between host genetic variants in the X-chromosome and microbiome data. The method accounts for random X-chromosome inactivation (XCI), skewed (or nonrandom) XCI (XCI-S), and escape of XCI (XCI-E). The inference is performed through a finite mixture model (FMM), in which an indicator variable denoting the “true” biological mechanism is treated as missing data. An expectation-maximization algorithm on zero-inflated and two-part models is implemented to estimate genetic effects. We investigate the performance of the FMM along with strategies that assume XCI and XCI-E mechanisms for all subjects compared with alternative approaches. Briefly, an XCI mechanism codes males’ genotypes as homozygous females, whereas under XCI-E, males are treated as heterozygous females. By comprehensive simulations, we evaluate tests of the hypothesis under a computationally efficient score statistic. In summary, the FMM renders reduced bias and commensurate power compared to XCI, XCI-E, and alternative strategies while maintaining adequate Type 1 error control. The proposed method has far-reaching applications. In particular, we illustrate its usage on a large-scale human microbiome study, the Genetic, Environmental and Microbial (GEM) project, to test for the genetic association on the X chromosome."
